{
  "id": "tpl_passport_td3_v1",
  "schemaVersion": "templategraph-v1",
  "familyId": "fam_passport_td3",
  "version": 1,
  "name": "Synthetic Passport TD3",
  "docType": "passport",
  "status": "active",
  "createdAt": 1780602754023,
  "updatedAt": 1780602754023,
  "pageCount": 1,
  "canonicalPages": [
    {
      "pageIndex": 0,
      "widthNorm": 1000,
      "heightNorm": 625
    }
  ],
  "anchors": [
    {
      "id": "anchor_passport_title",
      "type": "text",
      "pageIndex": 0,
      "boxNorm": [
        0.36,
        0.04,
        0.64,
        0.08
      ],
      "text": "PASSPORT",
      "importance": 0.95,
      "stability": 0.95,
      "mustNotContainVariableValue": true
    },
    {
      "id": "anchor_mrz_zone",
      "type": "special_zone",
      "pageIndex": 0,
      "boxNorm": [
        0.08,
        0.78,
        0.92,
        0.9
      ],
      "importance": 0.9,
      "stability": 0.9
    }
  ],
  "fields": [
    {
      "id": "tpl_field_passport_number",
      "label": "Passport Number",
      "aliases": [
        "Passport No",
        "Document No"
      ],
      "type": "id_number",
      "pageIndex": 0,
      "labelBoxNorm": [
        0.34,
        0.22,
        0.48,
        0.25
      ],
      "valueBoxNorm": [
        0.5,
        0.22,
        0.66,
        0.25
      ],
      "ocrMode": "roi_high_res",
      "required": true,
      "validatorIds": [
        "validator_passport_number_mrz_match"
      ],
      "sensitivity": "highly_sensitive"
    }
  ],
  "assets": [
    {
      "id": "tpl_asset_photo",
      "assetType": "photo",
      "pageIndex": 0,
      "boxNorm": [
        0.08,
        0.18,
        0.28,
        0.55
      ],
      "useSegmentationRefinement": false,
      "required": true,
      "validatorIds": [
        "validator_photo_present"
      ]
    }
  ],
  "tables": [],
  "codes": [],
  "validators": [
    {
      "id": "validator_passport_number_mrz_match",
      "validatorId": "mrz_visual_document_number_match",
      "targetIds": [
        "tpl_field_passport_number"
      ],
      "severity": "critical",
      "config": {}
    },
    {
      "id": "validator_photo_present",
      "validatorId": "asset_present",
      "targetIds": [
        "tpl_asset_photo"
      ],
      "severity": "high",
      "config": {}
    }
  ],
  "relationships": [],
  "aliases": {
    "Passport Number": [
      "Passport No",
      "Document No"
    ]
  },
  "fingerprint": {
    "layoutHash": "synthetic_layout_hash_passport_td3_v1",
    "textAnchorHash": "synthetic_text_hash_passport_td3_v1",
    "specialZoneHash": "synthetic_mrz_zone_hash"
  },
  "privacy": {
    "sensitivity": "sensitive",
    "containsSampleValues": false,
    "containsThumbnails": false,
    "exportWarningRequired": true
  }
}